news_date,news_title,news_summary
2022-08-05,Alum testing his engineering mettle at John Deere,Florida Polytechnic University alumnus Dorian Gray '20 works hard to ensure the tractors and other equipment produced by global manufacturing company John Deere are correct and adhere to quality standards.
2022-07-29,Internship opens Phoenix's eyes to world of software development,The opportunity to see how software development happens on a large scale was something Florida Polytechnic University rising senior Justine Kenji Dela Cruz was thrilled to take on.
2022-07-26,Talented international Fulbright cohort ready to work at Florida Poly,Outstanding international students and researchers are slated to arrive at Florida Polytechnic University in the 2022-2023 academic year to pursue their academic goals and advance research at the University as part of the United States' Fulbright Program. A Florida Poly student and assistant professor also will travel abroad as part of the program.
2022-07-21,Iconic Florida Poly building featured on international TV show,"The jaw-dropping Innovation, Science, and Technology Building at Florida Polytechnic University is featured on the latest episode of the international TV show ""How Did They Build That?"" on the Smithsonian Channel."
2022-07-18,Coca-Cola internship offers window to mechanical engineering opportunities,"Mechanical engineering major Sam Morrison is learning the process of Coca-Cola's supply chain inside out during a summer internship at the soft drink company's bottling and distribution facilities in Tampa, Florida."
2022-07-14,Professor's app to create one of the largest 3D facial scan libraries,"Dr. Oguzhan Topsakal, assistant professor of computer science at Florida Polytechnic University, has developed a cutting-edge, easy-to-use iOS app to collect detailed 3D facial scans. He aims to create one of the largest 3D facial scan libraries in the world."
2022-07-12,Publix opportunity paves way for promising analytics career,Senior Magelee Delgado is spending her summer maximizing a remarkable career opportunity that could define her professional future.
2022-07-05,Alum keeps supply chains running smoothly for South Florida company,"The work Greg Dills '18, '21 does as a senior data analyst for Ryder System, Inc. helps keep the Miami, Florida, company's transportation systems humming around the country."
2022-06-28,"Industry leader committed to teaching, inspiring students","Amy Augustyniak, a senior manager of supply chain analytics at Saddle Creek Logistics Services, works hard to help ensure the company's warehouses run smoothly."
2022-06-23,Professor recognized with prestigious industrial engineering fellow award,"Dr. Grisselle Centeno, a professor at Florida Polytechnic University, recently was inducted as a Fellow of the Institute of Industrial and Systems Engineers (IISE). The award is the highest classification of membership in IISE. It recognizes outstanding leaders of the profession that have made significant, nationally recognized contributions to industrial engineering."
2022-06-20,Florida Poly expands European footprint with presidential visit to Spain,"Dr. Randy K. Avent, president of Florida Polytechnic University, strengthened European ties and shared the University's approach to producing career-ready STEM graduates in a visit to Spain that concluded on Monday, June 20."
2022-06-14,Alum working to transform future of aquatic physical therapy,Florida Polytechnic University alumnus Abu Bony Amin '20 is working on research that could improve the assessment of aquatic physical therapy for patients with balance difficulties.
2022-06-09,New class of Presidential Ambassadors ready to work,"When Ahna Cecil was a freshman at Florida Polytechnic University, the data science major discovered a group of students who were polished, successful, and driven to support and represent their University. She was inspired to join them."
2022-06-08,Florida Poly to help improve access to high-speed internet in Polk County,"Researchers at Florida Polytechnic University are working to help close the gaps in broadband connectivity in Polk County through a $250,000 feasibility study recently approved by the Polk County Board of County Commissioners."
2022-06-01,Are you ready for hurricane season?,Forecasters predict a bustling 2022 Atlantic hurricane season. The season began June 1 and ends on Nov. 30. Florida Polytechnic University urges its students and employees to take early actions to prepare for possible storm impacts.
2022-05-31,"Brazilian university leaders learn innovation, technology trends at Florida Poly","Presidents, provosts, and other leaders from universities throughout Brazil visited Florida Polytechnic University on Friday, May 27, as part of an international mission to learn from some of the United States' best higher education institutions."
2022-05-26,Corporate Impact Network connects businesses to Florida Poly talent,Businesses that are part of Florida's high-tech surge and want to support the emerging generation of technological leaders are connecting directly to Florida Polytechnic University's valuable base of student and faculty knowledge through its Corporate Impact Network.
2022-05-23,"Florida Poly, Fulbright alum electrifies career as FCC engineer","As an electronics engineer for the Federal Communications Commission (FCC), Bobby Acacio '20 is living out his professional dreams."
2022-05-18,Sophomore balances entrepreneurship aspirations and life as an aerialist,"When Maggie Julian gets in a twist about complex assignments in her applied mathematics major, the Florida Polytechnic University student knows the perfect way to unwind and refocus her mind."
2022-05-17,Florida Poly launches two new master's degree programs,Florida Polytechnic University is introducing two new Master of Science degrees this fall in data science and engineering management. The two leading-edge graduate programs were created in response to growing University enrollment and high industry demand.
2022-05-10,"Phoenix escorts Vietnam veteran aboard Honor Flight to Washington, D.C.","Thomas Risalvato is driven to help people whenever he can. The rising senior at Florida Polytechnic University recently jumped at the opportunity to help in a unique way by serving as a guardian aboard a Flight to Honor trip to Washington, D.C."
2022-05-08,Florida Poly celebrates hundreds of in-demand grads at 2022 commencement,"More than 220 Florida Polytechnic University graduates celebrated the completion of their high-demand STEM degrees on Sunday, May 8, at the University's 2022 commencement ceremony."
2022-05-05,Q&A: Journey of curiosity and growth sets bright tech future for Ritchel Calvaire,"Ritchel Calvaire '22 receives his bachelor's degree in computer engineering on Sunday, May 8. The achievement is one that marks four years of exploration, development, and self-realization at Florida Polytechnic University."
2022-05-04,The Force guides Florida Poly students inspired by the Jedi way,"While members of the Force Institute may regularly train with their lightsabers on campus, their focus isn't solely on the wildly successful Star Wars galaxy of media."
2022-05-02,Engineering students earn awards at prestigious statewide science conference,Three Florida Polytechnic University graduate students pursing master's degrees in engineering recently took home top honors for their research at the Florida Academy of Sciences 85th Annual Meeting. All three students are on the mechanical engineering degree track.
2022-04-28,Capstone event showcases high-tech student projects,"Teams of Florida Polytechnic University seniors showed off their hard work on industry-sponsored, tech-focused projects at the annual Capstone Design Showcase on Wednesday, April 27."
2022-04-27,"Q&A: Grad launches engineering career with optimism, Olympic dreams","Bruce Hicks '22 will receive his bachelor's degree in electrical engineering from Florida Polytechnic University on May 8. The student from Eustis, Florida, is an accomplished archer with his sights set on competing in the 2028 Olympics."
2022-04-26,Spring Game Expo draws hundreds to try newest student video games,"Video game players went head-to-head in fun competitions at Florida Polytechnic University on Saturday, April 23, at the annual Spring Game Expo."
2022-04-25,Gary C. Wendt donates $2 million for new leadership initiatives at Florida Poly,Florida Polytechnic University announced a $2 million gift from Trustee Gary C. Wendt to support the creation of new leadership initiatives for students.
2022-04-21,Phoenix aspirations take flight at Kennedy Space Center,Nearly 100 Florida Polytechnic University students recently seized a unique opportunity to visit Kennedy Space Center to engage with aerospace leaders and explore high-tech employment opportunities.
2022-04-20,Q&A: Leadership and grit propel first-generation grad to success,"Vanessa Townsend '22 has never shied away from an opportunity to learn, grow, or lead. She will receive her bachelor's degree in mechanical engineering with a concentration in aerospace from Florida Polytechnic University on May 8."
2022-04-14,Florida Poly honors exemplary employees at 2022 Ablaze awards,"Outstanding faculty and staff members at Florida Polytechnic University were recognized on Wednesday, April 13, during the University's fifth annual Ablaze awards ceremony. The event shines a spotlight on the dedication, work, and successes of faculty and staff members and their many contributions to Florida Poly."
2022-04-13,Q&A: Everything's going according to plan for computer engineering grad,"When Javier Lozada '22 receives his bachelor's degree in computer engineering with a concentration in embedded systems design from Florida Polytechnic University on May 8, the talented student will be ready to step into a job as a software engineer at L3 Harris Technologies."
2022-04-12,"Freshman gets to work inside, outside the classroom",Students who head to the Student Development Center (SDC) for a workout are likely to encounter Natasha Gattas' smiling face welcoming them.
2022-04-06,"Q&A: Smashing stereotypes and hitting goals, Hailey Skoglund is ready to make a difference","When Hailey Skoglund '22 arrived at Florida Polytechnic University, she made the decision to embrace everything the University had to offer. "
2022-04-05,Innovative research creates virtual reality tool to help doctors in training,"Dr. Doga Demirel, assistant chair of Florida Polytechnic University's Computer Science Department, is creating a leading-edge virtual reality tool to help doctors learn critical medical procedures commonly performed in emergency rooms, during surgery, and in other medical scenarios."
2022-03-31,Florida Poly expands athletics with new archery range on campus,"Just weeks before his graduation with a bachelor's degree in electrical engineering, Florida Polytechnic University student Bruce Hicks is excited to see his vision for a campus archery range come to fruition."
2022-03-29,Bottorff joins Florida Poly as VP of administration and finance,Dr. Allen Bottorff has joined Florida Polytechnic University as the new vice president of administration and finance.
2022-03-24,"NSF grant funds research at Florida Poly to develop reliable, energy efficient electronic devices",Developing error-resilient and highly energy efficient computing platforms for ultra-low power applications will be the focus of a new research at Florida Polytechnic University funded by a grant from the National Science Foundation (NSF).
2022-03-22,Florida Poly graduates earn highest salaries among all public colleges in Florida,"Florida Polytechnic University graduates earn an average salary of $57,900 one year after graduation, the highest among all state universities, according to the State University System of Florida's MyFloridaFuture educational research and comparison tool."
2022-03-21,Students Give a Saturday to help others in need,"For Florida Polytechnic University junior Pressley Hendrix, volunteering and helping has always been second nature."
2022-03-17,Robotics teams take on challengers throughout Florida and the nation,Combat and VEX U robotics teams representing Florida Polytechnic University have kicked off the spring competition season with strong showings against their opponents.
2022-03-16,"Florida PolyCon brings geeky, comic fun back to Lakeland","Florida Polytechnic University's unique daylong celebration of comics, anime, videogames, movies, and all things geek returns to the Lakeland, Florida on Saturday, March 19."
2022-03-15,Florida Poly receives $2.05 million infusion during inaugural Giving Day,"More than $2 million was raised to support Florida Polytechnic University scholarships, academic departments, and student organizations during the University's inaugural Giving Day on Monday, March 14."
2022-03-11,Female leaders lauded at annual Women in STEM Awards,"Three women who carved their place in male-dominated STEM fields such as engineering, data science, and technology were recognized at Florida Polytechnic University's annual Women in STEM Awards luncheon on Thursday, March 10."
2022-03-09,Autonomous vehicles inspire leaders at international conference hosted by Florida Poly,Global leaders in connected and autonomous vehicle (CAV) research and industry gathered at Florida Polytechnic University to discuss developments in the technology and the future of self-driving cars during the annual Institute of Electrical and Electronics Engineers (IEEE) International Conference on Connected Vehicles.
2022-03-08,Canadian scholar advances energy research as visiting Fulbright Chair,"Dr. Jing Jiang, a visiting Fulbright Canada Research Chair from the University of Western Ontario in London, Ontario, Canada, is partnering with Dr. Hisham Mahmood, assistant professor of electrical engineering at Florida Polytechnic University, to research new ways to improve the country's power system resilience."
2022-03-07,Capstone team designs microgravity simulation device for Florida Space Institute,A team of Florida Polytechnic University capstone students is designing a device that will help engineers at Florida Space Institute and the Hawking Center for Microgravity Research effectively perform microgravity simulations.
2022-03-03,Spring break campus services and closures,"Students will enjoy a much-deserved weeklong break from class starting on Monday, March 7 as spring break begins. We hope you have a safe and fun time and return to classes on March 14 recharged and ready to tackle the end of the semester."
2022-03-03,"Global AV technology leader shares insight on industry challenges, rewards, and female encouragement","Connected and autonomous vehicle technology experts will gather at Florida Polytechnic University on March 7-9 for the annual Institute of Electrical and Electronics Engineers (IEEE) International Conference on Connected Vehicles. Among the industry leaders who will share their expertise in this quickly evolving field is Mary Joyce, global vice president and general manager of critical systems and mobility at UL, the global safety science leader."
2022-03-02,Disney shares magical opportunities with Florida Poly students,"Michael Tschanz, director of engineering technology and analysis at Walt Disney World, shared with Florida Polytechnic University students the many ways they can put their technical expertise to work in a career with Disney."
2022-03-02,Global tech visionary to speak at Florida Poly's 2022 commencement,"The Honorable Zachary J. Lemnios, a renowned thought leader in electrical engineering, former assistant secretary of defense, and former vice president of IBM Research, has been named speaker for Florida Polytechnic University's spring 2022 commencement."
2022-03-01,Society of Women Engineers builds inclusive campus culture,The Florida Polytechnic University chapter of the Society of Women Engineers (SWE) prides itself on being a supportive and motivating group for students on campus.
2022-02-24,Florida Poly Writing Services certified as tutor training program,"Florida Polytechnic University announced this week that its Department of Arts, Humanities, and Social Sciences' Writing Services program has been awarded certification as a Level 1 tutor training program by the internationally recognized College Reading and Learning Association (CRLA)."
2022-02-23,Students shift into high gear to build Florida Poly's first solar vehicle,An interdisciplinary team of Florida Polytechnic University students is revving up to build the University's first competition-worthy solar vehicle and take on some of the biggest schools in the country.
2022-02-22,International autonomous vehicle conference set to roll into Florida Poly,"Connected and autonomous vehicle (CAV) technology will take center stage at Florida Polytechnic University on March 7-9 at an international conference focusing on advances in this rapidly evolving field. Global leaders in transportation, CAV innovation, and infrastructure will take part in the event."
2022-02-21,Financial aid makes dream a reality for first-generation student,"As Ivelisse Rodriguez progressed through high school and the time to enter college neared, she wondered how she'd pay for the education she always dreamed of. While she aspired to be the first in her family to go to college, the path toward her dreams was unclear."
2022-02-18,Florida Poly director named Bartow Chamber Board president,"Early in her career, Shannon Medley turned to Leadership Bartow, a program of the Greater Bartow Chamber of Commerce, to help her enhance her civic participation as an emerging community leader."
2022-02-17,Polk County leader joins Florida Poly Foundation Board,"Ana Wood, waste and recycling director for the Polk County Board of County Commissioners for more than 20 years, has joined the Florida Polytechnic University Foundation Board of Directors. Her appointment was confirmed unanimously by the Florida Poly Board of Trustees during its meeting on Wednesday, Feb. 16."
2022-02-16,"Tech, business leader urges students to ""go big""","The adaptability, technological know-how, and big dreams of Florida Polytechnic University students make them poised to be the creators of the world's next big thing. That was the message Adrian Muhammad, managing partner of Jackson | Shah & Company, had for students during the return of the Innovation Speaker Series at the University on Tuesday, Feb. 15."
2022-02-14,Middle schoolers discover STEM possibilities at Florida Poly,"Addisen Cannoy, an eighth grader at Academy Prep Center of Lakeland, was excited to learn about the possibilities available to her one day as a student at Florida Polytechnic University."
2022-02-09,Students find exciting opportunities at spring career fair,"Resume in hand and decked out in a slick business suit, Florida Polytechnic University senior Zane Sheets worked to make a great first impression on potential employers during the Spring 2022 Career and Internship Fair on Tuesday, Feb. 8."
2022-02-08,Florida Poly sees 30% surge in applications for the second year in a row,The number of freshmen applying to Florida Polytechnic University has leapt 30% ahead of the same point in 2021 while out-of-state applications are up 61%. The surge comes as many higher education institutions across the country continue to struggle with enrollment.
2022-02-02,Florida Poly Women's Powerlifting readies for national title,"Florida Polytechnic University's Women's Powerlifting team is killing it in its inaugural year, and has already earned a spot on the national stage."
2022-02-01,"NSBE offers connection, opportunity to budding Black engineers at Florida Poly","As the leader of the Florida Polytechnic University chapter of the National Society of Black Engineers (NSBE), Catherine Abraham is thrilled to play a role in helping Black students on campus feel welcome and supported."
2022-01-31,"Students build fun, opportunities with Legoland Florida",Students who have always wanted to be Lego master builders got their shot on National Lego Day at Florida Polytechnic University.
2022-01-28,Florida Poly president makes Tampa Bay's Power 100 list,"Dr. Randy K. Avent, president of Florida Polytechnic University, was named one of the most influential businesspeople in the Tampa Bay area by the Tampa Bay Business Journal. The publication recently revealed its annual Power 100 list recognizing the region's most impactful business leaders."
2022-01-27,Intramural sports offer Phoenixes fun competition,"When Cadreeo Hudson '20 arrived as a freshman to the Florida Polytechnic University campus, he was excited to sign up for intramural sports as a way to meet people, enjoy a little competition, and have fun."
2022-01-25,Florida Poly department chair joins prestigious journal's editorial board,"Dr. Bruce Jacob, an internationally recognized researcher and chair of the Department of Electrical and Computer Engineering at Florida Polytechnic University, has joined the editorial board of IEEE Access."
2022-01-19,Students to gain career momentum at Saddle Creek Day on Campus,"One of the most daunting parts of the college experience is looking for a job to step into after graduation. Saddle Creek Logistics Services, Florida Polytechnic University's largest corporate partner, will host Saddle Creek Day on Campus on Thursday, Jan. 20, to engage with students and share ways to successfully begin their careers."
2022-01-18,Rotaract Club of Florida Poly works to help University community and beyond,"The mission that drives the Rotaract Club of Florida Poly is rooted in service to community and to others. Student members can help others and be of service while expanding their networking circle, developing leadership skills, and enjoying mentorship and peer camaraderie."
2022-01-13,Sophomore becomes first US Navy Officer Candidate from Florida Poly NUPOC program,"As Patrick Cole works toward his bachelor's degree at Florida Polytechnic University, he is now secure in the knowledge that he will have a steady income for the remainder of his education and a well-paying career waiting for him after graduation."
2022-01-11,FIPR secures $150K grant to create U.S. source of critical rare earth elements,"The production of computers, solar panels, smartphones, electric cars, and more all rely on a steady supply of rare earth elements. China currently supplies most of the world's rare earth elements, but a new Department of Energy grant awarded to Florida Polytechnic University's Florida Industrial and Phosphate Research Institute (FIPR) aims to change that."
2022-01-10,New online tool helps bolster STEM careers from Florida Poly,"Talented high school students who aim to pursue high-wage careers in science, technology, engineering, and math can now easily learn how Florida Polytechnic University can help them achieve their goals through an innovative online tool."
2022-01-07,Positivity and commitment to service drive Florida Poly police officer,Officer Bobby Neil brings a specific mindset to his daily work with the Florida Polytechnic University Police Department.
2021-12-30,Here are Florida Poly's top 10 stories of 2021,"The end of 2021 marks a year filled with national recognition, exceptional growth, and incredible achievements. Amid a changed global landscape, the Florida Polytechnic University community worked hard to continue growing and moving forward. The year's highlights included impressive U.S. News and World Report and other rankings, international accolades for stellar faculty members, and innovative opportunities for hands-on learning. Read the list of Florida Poly's top 10 stories of 2021."
2021-12-16,Student food pantry gets boost from corporate donor,The food pantry at Florida Polytechnic University aims to take a big burden from the shoulders of students who may not know exactly where their next meal will come from.
2021-12-13,Winter break campus services and closures,"The 2021 winter break begins on Saturday, Dec. 17. We hope you have a relaxing winter break and a happy holiday season. The list below outlines the closures and services available at Florida Polytechnic University through the winter break. We look forward to seeing you back on campus on Monday, Jan. 10."
2021-12-09,Annual toy drive benefits children in Lakeland and Honduras,"The Florida Polytechnic University community mustered its spirit of charity and goodwill this season and stepped up to donate toys, books, and other gifts to children who could use a little extra cheer this holiday season. The donations will be delivered to pediatric patients at Lakeland Regional Health Medical Center and to children in an impoverished community in Honduras."
2021-12-07,Three Florida Poly professors among world's top 2% of scientists,"With research interests in nanomedicine, energy systems, and rare earth element recovery, three Florida Polytechnic University professors have been named to the prestigious global list of top scientists compiled annually by Stanford University."
2021-12-06,Student-created video games draw big crowds,"For the first time in two years, the Florida Polytechnic University Fall Game EXPO returned to in-person gameplay on Saturday, Dec. 4, energizing student game developers and attracting hundreds of game-loving high schoolers to campus."
2021-11-30,Autonomous car arrives at Florida Poly to enhance research at new facility,"Researchers at Florida Polytechnic University's Advanced Mobility Institute are beginning a new phase in their work on autonomous vehicle testing and verification. The research is shifting gears from software to hardware testing at a new simulation facility on campus, funded in part by a $350,000 grant from the National Science Foundation."
